{
  "file": {
    "name": "good-deck.pptx",
    "sha256": "de9418ef0fed7dcdddaa9bfcf71a3b12579ad63c1d61ed3ad02c7f274c28a99b",
    "slides": 1
  },
  "findings": [],
  "profile": "baseline",
  "renderer": {
    "detail": "",
    "requested": "wireframe",
    "status": "ok",
    "used": "wireframe"
  },
  "schemaVersion": "decklint-report/v1",
  "scores": {
    "calculation": {
      "integrityCriticalCapApplied": false,
      "method": "weighted-average-rounded",
      "weightedTotal": 100.0
    },
    "categories": {
      "accessibility": 100,
      "consistency": 100,
      "editability": 100,
      "integrity": 100,
      "readability": 100
    },
    "deductions": [],
    "overall": 100,
    "policy": {
      "integrityCriticalOverallCap": 49,
      "lowConfidenceAffectsScore": false,
      "perRuleCap": 30,
      "privacyAffectsScore": false,
      "severityDeductions": {
        "critical": 30,
        "high": 15,
        "low": 1,
        "medium": 5
      },
      "startingScore": 100
    },
    "weights": {
      "accessibility": 0.1,
      "consistency": 0.15,
      "editability": 0.2,
      "integrity": 0.3,
      "readability": 0.25
    }
  },
  "slides": [
    {
      "index": 1,
      "preview": "data:image/png;base64,iVBORw0KGgoAAAANSUhEUgAAA8AAAAIcCAIAAAC2P1AsAAAT1ElEQVR42u3de3TU1YHA8ZsZCO45Buqj69buqV2sIKIgIihgCQmBYIDEoIGUl6gEFdBUFISaqEEpPvCFCvJQQYMQQYSyi4C8FBV81FfVCirqoqKuxUIAZUKG/WM0h2YwtVJf9PM5nuMwc3937sz85pwvv3MTUjpk5gQAAODriXgLAADg66uX+N/yRbO8FwAAUIesnv2CK9AAABBs4QAAAAENAAACGgAABDQAAAhoAABAQAMAgIAGAAABDQAAAhoAAAQ0AAAIaAAAQEADAICABgAAAQ0AAAIaAAAENAAACGgAAEBAAwCAgAYAAAENAAACGgAABDQAAAhoAABAQAMAgIAGAAABDQAAAhoAAAQ0AAAIaAAAQEADAICABgAAAQ0AAN+/ej+0BS2cP9enAgDA3vJ6FQjouvTpX+QsAQAgoaJ8WrCFAwAAgj3QAAAgoAEAAAENAAACGgAABHQIIcyZ+4cuPft373VO19wBDy145JtNcvvkGV9nWJMWnep49JfNOuQXDjmjz5AuPfqtffr5vzvb+g0bZ5TPc54BAAS/B/o7s+rxtQ88uHDerMmNGqZt3VY54Lzf/vzII05te9I3COiLLhy0n4tJrV//4TlTQwh/Xv/m0OKSVUvm1D2+aZPGTZs0dp4BAARXoL8zk6bef+WY4kYN00IIjRqmlY4unjh5RvjbS8WJ2+s3bMwtOC89u/eUux+oub94ZNn0GXNuvGXKjp07+wwYtnXrtmGXlBb0H5rXu+iFl16tNaxmwqzufd9+d1MIoXL7jnad8vfs2VNrVcc2OXrzRx8nz9Y5p+/mDz8OIcRisfYZveLxeGJtySM7ZPZ67/3NIYTCgcNLyiaEEJ5a98cLLv6dkxIAILgCvT/eePPtE5ofW/PHFscfu37Dxn2OvOe+iitGDW96zNHp2b3PP69vCGFXLHZGz64ZHduFEKbdO7vi/jtHjL7mvLP7nHTi8e9/8OHAwSNWLH6g1rCE/NxujyxbPbRowMrVT+Z0y0hJSan1XKvXrDutXZuy8bfVmq1HTuelyx8f1P+sJ9Y+l5HeLhL54q8oySMz0tuvfeaFM/OOiMfjr7y2IYSw9pnnMzt1cFICAAjof6Y9e/bs2Lmz1p3xeDyEUDqmeMGipctWrKncviNxfzQaTT/tlL1Hrnps7dvvbErc3rnzs+rqeDQaSR6Wn5t9YXHJ0KIBSx59bNj5Z9fcH6uqyi8csnv37jfeeufxZXOzcwfUmi03J6ukbMKg/mctW7EmPze7jufNTG//P0tWNm92zPHNj33tzxu279i57pkXBvY900kJACCg90vTYxq//MrrbVq3SPzx5Vdeb/qrxjXRHELYuq0yVrU7hFA09PLup2cOHlQ488uf26sXjdZcA06orq6eM/OOBg1S4/H4M8+9GI1G9jnsyJ8dEYmkbP7w403vbT7+uCYhaQ/0nVPuq5i3KHm2oxsfteXTrZXbd7zy6vrxZaPqeN72p7Yed8Mdz/7x5VPanPhvBzV4at1zsV2xnx5+qJMSACDYA70/hl9w9jXX3batcnuilcddf3viZwHT0g5O7OWYv+CRxA6LF//0Wm73Lp/v2rUrVpU8Tzwej8fjbU9uuXjpqhDCytVPTZw0o47nzevR9aprb8ns1H6fj3Y87ZQXXnp1n7N165p+++QZrVo233vjR/LIgw5q8O8/PWzxkpVtW7ds2+bEu6bPanfqSc5IAIDgCvR++nWHtps//PisfhdGI5E33nw7hPDupvdDCOOuHlk0fPThhx3SqmXzBqmpIYRz+hf0OPPc5s2OadQwLRaLpaam7j3PKW1bDSwaccO1Yy4bM27mrIfq1YveNL4k+en+65e/mDjp3ouHnpPbPau0bMKYkUP3uapfNT7qtdffmDdr8qgrxteaLTcnq1O3wvmzp+w9fmzppcnPm5HernzOgkMOadS61QlPP/vC5Zde6IwEAPiBS+mQmRNCWL5o1g9kQQvnz+3Tv6iOAVs+/evr699qf2rrb3slH2z+qHhk2dzySc4SAIDvUUX5tLxeBT+ElWT17Bd+jP8S4aGH/OQ7qOelyx8fOPiSK8cUO2UBAAg/6t/C8d3IzuqYndXR+wAAQPgx/lPeAAAgoAEAQEADAICABgAABDQAAAhoAAAQ0AAAIKABAEBAAwCAgAYAAAQ0AAAIaAAAENAAACCgAQBAQAMAgIAGAAAENAAACGgAABDQAAAgoAEAQEADAICABgAABDQAAAhoAAAQ0AAAIKABAEBAAwCAgAYAAAQ0AAAIaAAAENAAACCgAQBAQAMAgIAGAAAENAAACGgAABDQAAAgoAEAQEADAICABgAABDQAAAhoAAAQ0AAAIKABAEBAAwCAgAYAAAQ0AAAIaAAAENAAACCgAQBAQAMAgIAGAAAENAAACGgAAPg21fsBrqmifJoPBgAAAf215PUq8KkAABBs4QAAAAENAAACGgAAENAAACCgAQBAQAMAgIAGAAABDQAAAhoAABDQAAAgoAEAQEADAICABgAAAQ0AAAIaAAAQ0AAAIKABAEBAAwCAgAYAAAENAAACGgAAENAAACCgAQBAQAMAgIAGAAABDQAAAhoAABDQAAAgoAEAQEADAICABgAAAQ0AAAIaAAAQ0AAAsP/qHagvbOH8uT5dAIDvV16vAgH9Y9Knf5GzFgDg+1JRPi3YwgEAAMEeaAAAQEADAICABgAAAQ0AAAL6h+iXzTrkFw5J/HfX9Fm1Hl2/YeOM8nm17mzSotO3tJh/dOZ/aPy3t2wAgOD3QP/rSK1f/+E5U7/q0aZNGjdt0tg5AQBAcAV6nzrn9N384cchhFgs1j6jVzweT1y4/b9PtgwcPCKvYPDFl12dGLl167Zhl5QW9B+a17vohZdeDV9e5R0/YdIZfYZknv6bxUtXhRC2fPrXcy8YmV84pM+AYZ/8Zcs+j9rb2N/fllcwOK930f9u+mD9ho25BeelZ/eecvcDyVPVHPLJX7ZkdCtcv2Fj8uTJy064e2ZFVve+XXr0W71mXa2L0zW3m7To9NtRY09Jz5s566Fhl5S27ZibWEYdD9VacGJk8ciy6TPmZHXv+/a7m0IIldt3tOuUv2fPHt80AEBAHwh65HReuvzxEMITa5/LSG8XiXzxbpSNuzWvR5eFc6ef3rXT57tiIYSy8bedd3afueWTJt16zWVjxiWGxaqqDj3kJwsqpt47ZUJJ2YQQwtXX3tIzJ+vhOVPzc7NvvGXKPo+qsSsWa9mi2cK50wf0zb/q2pvvua/iilHDF1ZMnzT1vuSpEodUVVWdf9Hvrrny0qZNGidPnrzshJsnTl/w4PTJt4176OHFX/VWfL4rNrBvr/mzp4wuvW7woML5s6ckllHHQ7UWnHhFZ/TsOnhQYX5ut0eWrQ4hrFz9ZE63jJSUFN80ACDYwvFjFKuqyi8ckrh9xajhuTlZJWUTBvU/a9mKNfm52TXDnlz33M3Xl4QQunT+dTQaCSGsemzt2+9sSjy6c+dn1dXxaDQSj+8pLOgZQjjqFz+vrNweQljz1LM3XVcSQijo1SOnW2Z61961jrrx1ruefvbFonN+k5OdkZKSkpOdEULIzckqG3fr2tULFixaumzFmsrtO5KnSkwyuvT6M/NOP619m30uKXnZCZ0zOlw04spBAwpuv3lsrTckHo9/8RepSErLE46LRiP169dveUKzSCTy2Wef1/1Q6ZjivRccQohGo+mnnRJCyM/NvrC4ZGjRgCWPPjbs/LN9zQAAAR0OmD3QWz7dWrl9xyuvrh9fNqrmzqqq3Ykbe+LxxPaD6urqOTPvaNAgNR6PP/Pci4k8Ta1fr1HDtMTIxEXW6urqxPhoNNIw7eDko0ZfOrTmWSKRSCQS/WJhqalFQy/vfnrm4EGFM8vnJU8VQtgVi72+4a0QQt8+eftcUvKyEyZOuHrdM89PvWf2/IVLbrvxqppo3rqtMvblIan16yde1EENUmuuxNf9UK0FhxDqRaOJAUf+7IhIJGXzhx9vem/z8cc18TUDAIItHAeMbl3Tb588o1XL5ntvM2jTusWSRx8LISxeuipRom1PbpnY5bxy9VMTJ82oKeBas7Vq2Txx4KyKBeNuuGOfR9XYvbt6xeonQgh/WLy8Q7uTX/zTa7ndu3y+a9euWFXyVCGEBqmpi+bdvem9D8rnPLzPJSUvO4SwrXL7GX2GtD6pxR03j12x6skQQlrawes3bAwhzF/wyP7srai14FryenS96tpbMju19x0DAIIr0OGA2MJx8kktErs4OnUrnD97yt7DykpGXHTpVXfPfLBN6xYNUlNDCGNLL71szLiZsx6qVy960/iSr5q/rGTEJZePvee+uQ3TDr795rIdO3bWcdRBDVL/+5GVd065v1HDtFtuKP3PI/+jx5nnNm92TKOGabFYrNZUNck+eeK4nPxBzZs1SV5S8rJDCA3TDu7a+bSc/EF74vERFw8OIYy7emTR8NGHH3ZIq5bNa4Z9A+f0L9h7wal/O1Vu96zSsgljRg71HQMADjApHTJzQgjLF806wF7Ywvlz+/Qv8gF/Xz7Y/FHxyLK55ZO8FQDwL6uifFper4ID6RVl9ewXbOHg27B0+eMDB19y5ZhibwUAEGzhgL8rO6tjdlZH7wMAEPwQIQAACGgAAEBAAwCAgAYAAAENAAACGgAABDQAAAhoAABAQAMAgIAGAAABDQAAAhoAAAQ0AAAIaAAAQEADAICABgAAAQ0AAAIaAAAENAAACGgAAEBAAwCAgAYAAAENAAACGgAABDQAAAhoAABAQAMAgIAGAAABDQAAAhoAAAQ0AAAIaAAAQEADAICABgAAAQ0AAAIaAAAENAAACGgAAEBAAwCAgAYAAAENAAACGgAABDQAAAhoAABAQAMAgIAGAAABDQAAAhoAAAQ0AAAIaAAAQEADAICABgAAAQ0AAAIaAAAENAAACGgAAEBAAwCAgAYAAAENAAACGgAABDQAAAhoAABAQAMAgIAGAAABDQAAAhoAAAQ0AAAIaAAAQEADAICABgAAAQ0AAAIaAAAENAAACGgAAEBAAwCAgAYAAAENAAACGgAABDQAAAhoAABAQAMAgIAGAAABDQAAAhoAAAQ0AAAIaAAAQEADAICABgAAAQ0AAAIaAAAENAAACGgAAEBAAwCAgAYAAAENAAACGgAABDQAAAhoAABAQAMAgIAGAAABDQAAAhoAAAQ0AAAIaAAAQEADAICABgAAAQ0AAAIaAAAENAAACGgAAEBAAwCAgAYAAAENAAACGgAABDQAAAhoAABAQAMAgIAGAAABDQAAAhoAAAQ0AAAIaAAAQEADAICABgAAAQ0AAAIaAAAENAAACGgAAEBAAwCAgAYAAAENAAACGgAABDQAAAhoAABAQAMAgIAGAAABDQAAAhoAAAQ0AAAIaAAAQEADAICABgAAAQ0AAAIaAAAENAAACGgAAEBAAwCAgAYAAAENAAACGgAABDQAAAhoAABAQAMAgIAGAAABDQAAAhoAAAQ0AAAIaAAAQEADAICABgAAAQ0AAAIaAAAENAAACGgAAEBAAwCAgAYAAAENAAACGgAABDQAAAhoAABAQAMAgIAGAAABDQAAAhoAAAQ0AAAIaAAAQEADAICABgAAAQ0AAAIaAAAENAAACGgAAEBAAwCAgAYAAAENAAACGgAABDQAAAhoAABAQAMAgIAGAAABDQAAAhoAAAQ0AAAIaAAAQEADAICABgAAAQ0AAAIaAAAENAAACGgAAEBAAwCAgAYAAAENAAACGgAABDQAAAhoAABAQAMAgIAGAAABDQAAAhoAAAQ0AAAIaAAAQEADAICABgAAAQ0AAAIaAAAENAAACGgAAEBAAwCAgAYAAAENAAACGgAABDQAAAhoAABAQAMAgIAGAAABDQAAAhoAAAQ0AAAIaAAAQEADAICABgAAAQ0AAAIaAAAORPUO4NdWUT7NBwwAgID+WvJ6Ffh0AQAItnAAAICABgAAAQ0AAAIaAAAENAAAIKABAEBAAwCAgAYAAAENAAACGgAABDQAACCgAQBAQAMAgIAGAAABDQAAAhoAAAQ0AAAgoAEAQEADAICABgAAAQ0AAAIaAAAENAAAIKABAEBAAwCAgAYAAAENAAACGgAABDQAACCgAQBAQAMAgIAGAAABDQAAAhoAAAQ0AAAgoAEAQEADAICABgAAAQ0AAAIaAAAENAAAIKABAEBAAwCAgAYAAAENAAACGgAABDQAACCgAQBAQAMAgIAGAAABDQAAAhoAAAQ0AAAgoAEAQEADAICABgAAAQ0AAAIaAAAENAAAIKABAEBAAwCAgAYAAAENAAACGgAABDQAACCgAQBAQAMAgIAGAAABDQAAAhoAAAQ0AAAgoAEAQEADAICABgAAAQ0AAAIaAAAENAAAIKABAEBAAwCAgAYAAAENAAACGgAABDQAACCgAQBAQAMAgIAGAAABDQAAAhoAAAQ0AAAgoAEAQEADAICABgAAAQ0AAAIaAAAENAAAIKABAEBAAwCAgAYAAAENAAACGgAABDQAACCgAQBAQAMAgIAGAAABDQAAAhoAAAQ0AAAgoAEAQEADAICABgAAAQ0AAAIaAAAENAAAIKABAEBAAwCAgAYAAAENAAACGgAABDQAACCgAQBAQAMAgIAGAAABDQAAAhoAAAQ0AAAgoAEAQEADAICABgAAAQ0AAAIaAAAENAAAIKABAEBAAwCAgAYAAAENAAACGgAABDQAACCgAQBAQAMAgIAGAIAfh5QOmTneBQAACK5AAwDAP93/A6eEIsXpbmZcAAAAAElFTkSuQmCC",
      "title": "Quarterly Review"
    }
  ],
  "summary": {
    "critical": 0,
    "high": 0,
    "low": 0,
    "medium": 0
  },
  "toolVersion": "0.1.0"
}
